Name,Description,Excerpt,Tree species,Tour,Sequence
Black oak (Quercus velutina),"As you come up the hill, on your le...","As you come up the hill, on your left just before lamp post N 213, is a <i style=""color: rgb(156, 39, 176);"">black oak</i>, <b><i style=""color: rgb(156, 39, 176);"">Quercus velutina</i></b>. Dark rough bark and massive branches are quick guides to identification. The broad leaves end in sharp points, indicating membership in the red oak group. This oak is stag-headed, meaning that its dead crown and leafless upper limbs stand out like antlers against the sky. Prompt improvement of this disadvantaged site, with a fence, a thick planting of shrubs, mulching, and fertilizer, plus pruning of the tree, would possibly save the superb oak from destruction. It would be foresighted, however, to plant a young specimen in the vicinity for future replacement.",Quercus velutina,TOUR 1,30
Tulip trees (Liriodendron tulipifera),"On the left, the next big tree beyo...","On the left, the next big tree beyond the black oak is a <i style=""color: rgb(156, 39, 176);"">tulip tree</i>, <b><i style=""color: rgb(156, 39, 176);"">Liriodendron tulipifera</i></b>, with another to the right in the angle of the path. <i style=""color: rgb(156, 39, 176);"">Tulip trees</i> can be recognized by their squared-off leaf tips, their pale green and orange tuliplike flowers in early summer, and the tawny conelike fruits that often persist all winter. Like the black oak, the <i style=""color: rgb(156, 39, 176);"">tulip tree</i>s show the effects of hardship. Roots are exposed where soil has washed from the bare bank, and their thin bark has been damaged by thoughtless walkers.",Liriodendron tulipifera,TOUR 1,31
Cornus florida (Cornus florida),Just beyond the tulip trees are two...,"Just beyond the tulip trees are two <i style=""color: rgb(156, 39, 176);"">flowering dogwoods</i>, <b><i style=""color: rgb(156, 39, 176);""><i style=""color: rgb(156, 39, 176);"">Cornus florida</i></i></b>. The one to the left was unusually tall but the top has died as a result of drought, mechanical injury to the tender bark, and hard-packed soil. The still-unspoiled forest northeast of the Music Pagoda would be a sanctuary for dogwoods, as this untamed wilding grows best in undisturbed woodlands.",Cornus florida,TOUR 1,32
Willow oak (Quercus phellos),Go straight ahead until you come to...,"Go straight ahead until you come to a fork in the path. On your left, opposite lamp post N 210, are three <i style=""color: rgb(156, 39, 176);""><i style=""color: rgb(156, 39, 176);"">willow oak</i>s</i>, <b><i style=""color: rgb(156, 39, 176);"">Quercus phellos</i></b>. The largest is unusually tall. One of its branches hangs low over the path so that you can examine its foliage at close range. The leaves are so slender and their edges so smooth that they might easily be mistaken for willow leaves. If you find tassels of male flowers or acorns, you will know this for a true oak. Since it has the appeal of novelty as well as of beauty, the <i style=""color: rgb(156, 39, 176);"">willow oak</i> should be planted more frequently than it is.",Quercus phellos,TOUR 1,33
Red maple (Acer rubrum),Take the right fork of the path....,"Take the right fork of the path. About midpoint of the grassy triangle, on your left, is a <i style=""color: rgb(156, 39, 176);"">red maple</i>, this time a single-trunked specimen. The characteristic network of surface roots should help in identification. Behind the maple, near the other path, is a sweet gum, Liquidambar styraciflua, one of our finest native trees. The star-shaped leaves are cleanly cut and put on a superlative show of color in fall. The unmistakable spiny fruit balls can be seen on the ground or hanging from the outer branches.",Acer rubrum,TOUR 1,34
Sweet gum (Liquidambar styraciflua),Take the right fork of the path....,"Take the right fork of the path. About midpoint of the grassy triangle, on your left, is a red maple, this time a single-trunked specimen. The characteristic network of surface roots should help in identification. Behind the maple, near the other path, is a <i style=""color: rgb(156, 39, 176);"">sweet gum</i>, <b><i style=""color: rgb(156, 39, 176);"">Liquidambar styraciflua</i></b>, one of our finest native trees. The star-shaped leaves are cleanly cut and put on a superlative show of color in fall. The unmistakable spiny fruit balls can be seen on the ground or hanging from the outer branches.",Liquidambar styraciflua,TOUR 1,35
European hornbeam (Carpinus betulus),On the point of the triangle by lam...,"On the point of the triangle by lamp post N 208 is fantastically shaped <i style=""color: rgb(156, 39, 176);"">European hornbeam</i>. A three-foot stub of broken branch should have been cut flush with the trunk and sealed. Instead, the splintered wood was left exposed to invasion by fungus. Bright orange growths pushing through the bark show how the infection has spread into the main trunk. For lack of basic maintenance, this tree is doomed.",Carpinus betulus,TOUR 1,36
Hawthorn (Crataegus monogyna),"Across the walk on the left, behind...","Across the walk on the left, behind the fence, is a single-seeded English <i style=""color: rgb(156, 39, 176);"">hawthorn</i>, <b><i style=""color: rgb(156, 39, 176);"">Crataegus monogyna</i></b>. This is the flowering may of English hedgerows and ballads. The native rhododendrons, R. carolinianum, with their white or pale pink powderpuffs of bloom, make a pleasing complement to the <i style=""color: rgb(156, 39, 176);"">hawthorn</i>'s flowers.",Crataegus monogyna,TOUR 1,37
Cherry birch (Betula lenta),Behind the shrubs is a cherry birch...,"Behind the shrubs is a <i style=""color: rgb(156, 39, 176);"">cherry birch</i>, <b><i style=""color: rgb(156, 39, 176);"">Betula lenta</i></b>, a native tree too seldom seen in Prospect Park, especially in such large size. This birch may be recognized by its dark gray bark breaking into large, thick plates and by the brown catkins set upright on its branchlets.

A mountain of earth was bulldozed against the birch in June, 1967, cutting off air and water from its roots. Roots buried under even six inches of earth will suffocate, critically weakening a tree within a year and killing it in two. Grosser abuse will destroy it more rapidly. Shortly after the damage was done, the Park Department was notified of the threat to the birch and was urged to order immediate removal of the earth to prevent irreparable injury to the tree.",Betula lenta,TOUR 1,38
White oak (Quercus alba),"Turning back to the path, on the si...","Turning back to the path, on the side near the road is a large <i style=""color: rgb(156, 39, 176);"">white oak</i>. Can you remember its distinguishing marks? It was described early in the tour.

As you come out by the carrousel to Flatbush Avenue, you can turn left for a visit to historic Lefferts Homestead, walk across the street to the celebrated Brooklyn Botanic Garden, or turn right for the BMT. The subway entrance is hidden behind some stores, directly across the street from the bakery whose sign serves as guidepost.

The Friends of Prospect Park sounds like a superb organization and a timely opportunity to advance conservation measures to protect the beauty of Prospect Park. We can all hope that the maintenance improvement will be made and made soon. 
Sharon F. Francis, Stag Assistant for Beautification to Mrs. Johnson; the White House, 1967

""To properly maintain, improve and develop our parks demands intelligence, time and love of the work. The best of talent alone pays, for ignorance causes more destruction in a short time than years of constant endeavor can repair.""

",Quercus alba,TOUR 1,39
TOUR 2,"TOUR II

Willink Gate at Flatbush...","TOUR II

Willink Gate at Flatbush and Ocean Avenues, reached by BMT Brighton Beach Express. Get off at Prospect Park Station and follow arrows to Botanic Garden exit.",,TOUR 2,40
Boxwoods (Buxus sempervirens),This is the entrance near the carou...,"This is the entrance near the carousel. As you face the Park, take the walk on the left side of the highway. Two <i style=""color: rgb(156, 39, 176);""><i style=""color: rgb(156, 39, 176);"">boxwood</i>s</i>, <b><i style=""color: rgb(156, 39, 176);"">Buxus sempervirens</i></b>, about eight feet high, are on the near side of the road. One is close to the stone column, the other nearer the path. This, the <i style=""color: rgb(156, 39, 176);"">common box</i>, is native to northern Europe. North Africa, and western Asia. In warm climates, <i style=""color: rgb(156, 39, 176);"">boxwood</i> attains tree proportions. Here in the North it is on the borderline of survival and is so badly damaged during severe winters that it seldom gets beyond shrub size. The foliage of <i style=""color: rgb(156, 39, 176);"">boxwood</i> gives off a distinct musky odor, pleasing to some noses, disagreeable to others. It is most noticeable in enclosed or sheltered areas such as the front lawn of Lefferts Homestead.",Buxus sempervirens,TOUR 2,41
Tanyosho pine (Pinus densiflora umbraculifera),"Looking across the highway, you wil...","Looking across the highway, you will see an uncommon small pine from Japan, the <i style=""color: rgb(156, 39, 176);"">Tanyosho pine</i>, <b><i style=""color: rgb(156, 39, 176);"">Pinus densiflora umbraculifera</i></b>. A variety of the red pine, this species is also called umbrella pine because of its broad rounded top.",Pinus densiflora umbraculifera,TOUR 2,42
Chinese elm (Ulmus parvifolia),Walk ahead about thirty yards to a ...,"Walk ahead about thirty yards to a point where a path leads off to the right. In the angle of the paths is a <i style=""color: rgb(156, 39, 176);"">Chinese elm</i>, <b><i style=""color: rgb(156, 39, 176);"">Ulmus parvifolia</i></b>, which leans to the left. It has very small leaves with a grayish cast. The <i style=""color: rgb(156, 39, 176);"">Chinese elm</i> is a variable tree, differing in the shape of its leaves and in its bark. However much they vary in appearance, <i style=""color: rgb(156, 39, 176);"">Chinese elm</i>s agree in having distinctively small leaves and in flowering in August and September, unlike the American elm and most other species which bloom in spring. The <i style=""color: rgb(156, 39, 176);"">Chinese elm</i> has been widely advertised as being immune to Dutch elm disease. According to pathologists, no elm is immune, but the <i style=""color: rgb(156, 39, 176);"">Chinese elm</i> is among the more resistant species. It is very late to leaf out in spring and may cause panic in new owners when it stands leafless and apparently dead while other trees are green.",Ulmus parvifolia,TOUR 2,43
White oak (Quercus alba),Continue about thirty yards farther...,"Continue about thirty yards farther and turn onto the path that branches off to the right towards the highway. As you walk towards the traffic light, you will see on your right at the edge of the road a magnificent <i style=""color: rgb(156, 39, 176);"">white Oak</i>, <b><i style=""color: rgb(156, 39, 176);"">Quercus alba</i></b>. Go directly underneath it and admire the beautiful foliage patterns against the sky. The lobes and sinuses of the leaves are rounded. This is the distinguishing mark of the <i style=""color: rgb(156, 39, 176);"">white oak</i> group. <b><i style=""color: rgb(156, 39, 176);"">Quercus alba</i></b> can be identified by the light gray bark which flakes off in thin shreds, increasingly conspicuous on the upper trunk and branches.",Quercus alba,TOUR 2,44
Swamp white oak (Quercus bicolor),Still farther to the right is a swa...,"Still farther to the right is a <i style=""color: rgb(156, 39, 176);"">swamp white oak</i>, <b><i style=""color: rgb(156, 39, 176);"">Quercus bicolor</i></b>, a much smaller specimen. The rounded outlines of its leaves place it in the white oak group. In this species, the leaves broaden towards the tip instead of tapering. The branches are slender, and the lower ones droop like those of the pin oak. You can clinch the identification if you can find some acorns: the <i style=""color: rgb(156, 39, 176);"">swamp white oak</i> bears them in pairs on a distinct stalk.",Quercus bicolor,TOUR 2,45
Black oak (Quercus velutina),If you sight between these trees ac...,"If you sight between these trees across the road, you will see a large <i style=""color: rgb(156, 39, 176);"">black oak</i>, <b><i style=""color: rgb(156, 39, 176);"">Quercus velutina</i></b>. <i style=""color: rgb(156, 39, 176);""><i style=""color: rgb(156, 39, 176);"">Black oak</i>s</i> belong to the red oak group which is characterized by sharply cut, often needle-pointed leaves. <i style=""color: rgb(156, 39, 176);""><i style=""color: rgb(156, 39, 176);"">Black oak</i>s</i> can be distinguished from red oaks at a distance by the dark, deeply fissured bark broken into small plates, and by the massive, irregularly curved branches. If you can reach a twig or find a fallen one on the ground, you can confirm your identification. Buds of the <i style=""color: rgb(156, 39, 176);"">black oak</i> are dull-surfaced and fuzzy on the upper half, while those of the red oak are shiny below and fuzzy at the top. <i style=""color: rgb(156, 39, 176);"">Black oak</i> leaves are generally larger and less deeply cut than those of the red oak, but species show so much variation that this is not a liable distinction. Trust your first overall impression: black bark, heavy horizontal branches, and broad, solid-looking leaves mark the <i style=""color: rgb(156, 39, 176);"">black oak</i>, which in maturity is a truly majestic tree.

These oaks and other large trees in this heavily traveled area show dead tops and limbs, the result of injury caused by soil compaction. Roots need air as well as water. Neither can penetrate soil which is packed as hard as concrete. The root areas of irreplaceable trees should be protected by low fences or by barrier plantings of thorny shrubs.",Quercus velutina,TOUR 2,46
Willow oak (Quercus phellos),As you pause at the traffic light b...,"As you pause at the traffic light before crossing, you will see a <i style=""color: rgb(156, 39, 176);"">willow oak</i>, <b><i style=""color: rgb(156, 39, 176);"">Quercus phellos</i></b>, at the edge of the road on your left. The foliage is so slender that the tree is easily mistaken for a willow, especially in spring when the leaves are light willow green. Despite its deceptive foliage, the tree bears acorns and thus proves itself a true oak. <i style=""color: rgb(156, 39, 176);"">Willow oaks</i> are excellent subjects for street planting and general landscape use.",Quercus phellos,TOUR 2,47
Ginkgo (Ginkgo biloba),Cross the road....,"Cross the road. On the left is an unusual and beautiful <b><i style=""color: rgb(156, 39, 176);"">Ginkgo biloba</i></b>. This species is the most primitive type of tree you will see in the Park, as it was in existence before any of the other species developed. Typical <i style=""color: rgb(156, 39, 176);"">ginkgo</i> foliage is flat but this individual has slightly cupped leaves. Again, the more usual form has spreading, often horizontal branches. This particular specimen, with upright branches held close to the trunk, is a fastigiate form.",Ginkgo biloba,TOUR 2,48
American hornbeam (Carpinus caroliniana),"On the right of the path, at the ed...","On the right of the path, at the edge of the road, is a small, gray-barked tree with three main trunks. This is an <i style=""color: rgb(156, 39, 176);"">American hornbeam</i>, <b><i style=""color: rgb(156, 39, 176);"">Carpinus caroliniana</i></b>, one of the very few in the Park. If you examine its clusters of fruit closely, you will find three-lobed bracts in pairs, each with a nutlet in its cupped base. The <i style=""color: rgb(156, 39, 176);"">American hornbeam</i> can be distinguished from the widely planted European species in three ways: its bark is not conspicuously striped, the tip of the central lobe of the bract is pointed, and the leaves take on brilliant red and yellow coloring in autumn.",Carpinus caroliniana,TOUR 2,49
Tulip trees (Liriodendron tulipifera),Follow the path farther into the Pa...,"Follow the path farther into the Park and take a left turn at the intersection. You will pass between two splendid <i style=""color: rgb(156, 39, 176);""><i style=""color: rgb(156, 39, 176);"">tulip tree</i>s</i>, <b><i style=""color: rgb(156, 39, 176);"">Liriodendron tulipifera</i></b>. A mature <i style=""color: rgb(156, 39, 176);"">tulip tree</i> is notable for its towering height and for its straight trunk, often bare of branches up to the crown. Under favorable conditions, where roots are not damaged by compaction and erosion as they are here, this species will reach 150 feet. The square-cut leaf tips are a ready means of identification.",Liriodendron tulipifera,TOUR 2,50
Camperdown elm (Ulmus glabra 'camperdownii'),Walk through East Wood Arch....,"Walk through East Wood Arch. At the drinking fountain, take a short detour to the left, behind and beyond the Boat House, to see the renowned <i style=""color: rgb(156, 39, 176);"">Camperdown elm</i>. This is fully described in Tour I.

Returning to the drinking fountain, keep walking straight ahead. On the right you will see a large sycamore maple, Acer pseudoplatanus. This is a coarse, invasive tree suitable only for rough places and greatly overplanted in Prospect Park. The heavy-textured leaves are broad with deeply indented veins. The green flowers hang in long clusters and give the tree in spring a fleeting resemblance to a giant laburnum. The key fruits, also in grapelike clusters, are an easy mark of identification.",Ulmus glabra 'Camperdownii',TOUR 2,51
Sycamore maple (Acer pseudoplatanus),Walk through East Wood Arch....,"Walk through East Wood Arch. At the drinking fountain, take a short detour to the left, behind and beyond the Boat House, to see the renowned Camperdown elm. This is fully described in Tour I.

Returning to the drinking fountain, keep walking straight ahead. On the right you will see a large <i style=""color: rgb(156, 39, 176);"">sycamore maple</i>, <b><i style=""color: rgb(156, 39, 176);"">Acer pseudoplatanus</i></b>. This is a coarse, invasive tree suitable only for rough places and greatly overplanted in Prospect Park. The heavy-textured leaves are broad with deeply indented veins. The green flowers hang in long clusters and give the tree in spring a fleeting resemblance to a giant laburnum. The key fruits, also in grapelike clusters, are an easy mark of identification.",Acer pseudoplatanus,TOUR 2,52
Black haw (Viburnum prunifolium),On the right at the far end of the ...,"On the right at the far end of the bridge, the gracefully arched shrub is a <i style=""color: rgb(156, 39, 176);"">black haw</i>, <b><i style=""color: rgb(156, 39, 176);"">Viburnum prunifolium</i></b>. The bark of the trunk and older branches resembles that of a dogwood but in miniature scale. Foliage is clean and delicate and turns a glowing rose-red in fall.",Viburnum prunifolium,TOUR 2,53
Scarlet oaks (Quercus coccinea),About forty-five yards beyond the b...,"About forty-five yards beyond the bridge, by the tall post with two spotlights on the left, you will find two <i style=""color: rgb(156, 39, 176);"">scarlet oaks</i>, <b><i style=""color: rgb(156, 39, 176);"">Quercus coccinea</i></b>, just inside the fence. The leaves of <i style=""color: rgb(156, 39, 176);"">scarlet oaks</i> are shiny on the underside, with deeply cut, almost circular sinuses. The tree is notable for its flaming fall color.
Scarlet oaks are considered by some authorities to be natural hybrids between red and pin oaks. The latter species show great variation in the size and shape of their leaves. Their reputed offspring inherit the vagaries of both parents and even invent some diversities of their own. If you can't tell scarlet oaks from red or pin, don't worry. You're in good company. Experts sometimes disagree.",Quercus coccinea,TOUR 2,54
Tulip trees (Liriodendron tulipifera),"Behind the scarlet oaks, nearer the...","Behind the scarlet oaks, nearer the lake, are three <i style=""color: rgb(156, 39, 176);"">tulip trees</i> whose bark is worth observing. The slenderest of the three has normal straight-up-and-down striping. The two others show a spiral pattern which twists from the base right to the top.",Liriodendron tulipifera,TOUR 2,55
London planes (Platanus hispanica),Continue ahead to the temporary ref...,"Continue ahead to the temporary refreshment stand and turn right. In the gravel areas on the left of the path and on the right in front of the Music Pagoda are many <i style=""color: rgb(156, 39, 176);"">London planes</i>. Their peeling, piebald bark stands out among more soberly colored trees.",Platanus hispanica,TOUR 2,56
American elm (Ulmus americana),"Walk ahead, taking the first left t...","Walk ahead, taking the first left turn which brings you to the open meadow called the Nethermead. On a mound to the left, by lamp post M 230, stands a great <i style=""color: rgb(156, 39, 176);"">American elm</i>, <b><i style=""color: rgb(156, 39, 176);"">Ulmus americana</i></b>, the oldest tree in the Park. Its age is estimated by the Bartlett Tree Company as well over three hundred years. This elm was therefore a mature tree when George Washington's outnumbered forces fought their gallant retreat across this field on August 27, 1776. With the 200th anniversary of the Battle of Long Island approaching, it is more than ever essential to preserve this magnificent elm as a living monument.

In the early 1930's, the Park's arboriculturist, John Herlihy, supervised WPA work on the elm. The 20 foot cavity in the trunk was cleaned and filled and the enormous spreading canopy was reinforced with rods and cables to prevent splitting.

In the fall of 1967, the elm was given deep root feeding through the Camperdown Fund, a program organized by the Friends of Prospect Park to save the Park's historic trees. The Fund's resources in its first year were not sufficient to cover necessary pruning. This is a goa1 for tree lovers, patriots, and historians in 1968.

Elms have extremely shallow root systems which are especially vulnerable to injury from compacted soil. A temporary fence and mulching would loosen the soil, admit air and water, and encourage the growth of new feeding roots.

Before you leave, walk into the meadow for a full view of this truly noble tree, and bow to the memory of John Herlihy whose wise concern saved the great elm for your enjoyment and wonder.
Here's a good stopping point. If you are tired, come back and pick up the second half of the tour another day, or rest awhile in the Music Grove and start again at the American elm.",Ulmus americana,TOUR 2,57
Osage orange (Maclura pomifera),Continuing along the path bordering...,"Continuing along the path bordering the Nethermead, you come to an <i style=""color: rgb(156, 39, 176);"">Osage orange</i>, <b><i style=""color: rgb(156, 39, 176);"">Maclura pomifera</i></b>, with its two trunks secured with rods. The tree is native to Osage Indian country, a small area at the junction of Arkansas, Oklahoma, and Texas. The ""orange"" -- hard and inedible -- may grow as large as 5"" in diameter when mature in autumn. The glossy foliage is attractive but the tree is perhaps most striking in winter when its bright orange bark is fully revealed.",Maclura pomifera,TOUR 2,58
Pagoda tree (Styphnolobium japonicum),"On the right of the path, opposite ...","On the right of the path, opposite the Osage orange, is a grove of Sophora japonica, the scholar or <i style=""color: rgb(156, 39, 176);"">pagoda tree</i>. The largest, presumably the parent of the others, has an impressive buttress of surface roots, grown into a solid collar and covered with bark. A badly cut stub on the trunk has been corrected, and the exposed wood of other wounds sealed with dressing. This work was done without charge by the Bartlett Company as their contribution to the tree salvage program of the Friends of Prospect Park.",Styphnolobium japonicum,TOUR 2,59
Mockernut hickory (Carya tomentosa),"Just beyond the sophoras, inside th...","Just beyond the sophoras, inside the fence on the right, is a young hickory, a genus poorly represented in Prospect Park. In the absence of nuts, it is not possible to identify the species positively but all other characteristics -- fat buds, thick twigs, and horse-faced leaf scars -- point to the <i style=""color: rgb(156, 39, 176);"">mockernut hickory</i>, <b><i style=""color: rgb(156, 39, 176);"">Carya tomentosa</i></b>.

Pound for pound, the wood of hickory is stronger than steel but less brittle. Because of its resistance to the heat of friction, it was used for the hubs of wooden wheels. Hickory is unequaled for making handles for axes, chisels, and other striking tools because it can withstand the shock of impact without splintering. Its ability to endure violent strains makes it the prime material for wooden skis. General Andrew Jackson's affectionate nickname of ""Old Hickory"" was a double tribute to the toughness and resilience of man and tree.",Carya tomentosa,TOUR 2,60
English yew (Taxus baccata),Follow the stream a short distance ...,"Follow the stream a short distance ahead to lamp post G 232 on your left. Go up the steps and out to the road. On the far side, a little to your right, is a shrubby <i style=""color: rgb(156, 39, 176);"">English <i style=""color: rgb(156, 39, 176);"">yew</i></i>, <b><i style=""color: rgb(156, 39, 176);"">Taxus baccata</i></b>, about 15 feet high. Like boxwood, this <i style=""color: rgb(156, 39, 176);"">yew</i> is on the borderline of hardiness in this region. A specimen of this size is unusual. The fruit is red and contains poisonous seeds.",Taxus baccata,TOUR 2,61
