Name,Description,Excerpt,Tree species,Tour,Sequence
Front Matter,"Tree Trails in Prospect Park

...","Tree Trails in Prospect Park

By George Kalmbacher, Taxonomist, Brooklyn Botanic Garden, and M. M. Graff

© 1968 Greensward Foundation, Inc.  All rights reserved.

""The Camperdown Elm"" by Marianne Moore 
From the Complete Poems of Marianne Moore 
Copyright © 1967 by Marianne Moore
Originally appeared in The New Yorker
Reprinted by permission of The Viking Press, Inc.

Publication of this guide to trees in Prospect Park was made possible by generous gifts from the following: John W. Corrington, Jr.; J. M. Kaplan Fund, Inc.; Charles Lauriston Livingston, Jr., in memory of his sister, Cornelia Duryea Livingston Graeser; Elise W. Stutzer; John T. Underwood Foundation.",,Introduction,1
INTRODUCTION,Here is an invitation to an outdoor...,"Here is an invitation to an outdoor adventure.

Learning to recognize trees on an unmarked trail is like a treasure hunt. We provide the clues: you have the fun of following them. If you lose the trail, backtrack to a numbered lamp post and try again. The numbers are on small bands about three feet above ground, just below the ornamental wreath which separates the shaft of the lamp post from its base.

Beginners are advised to concentrate on the trees most frequently planted in Prospect Park: oaks, lindens, sophora, maples, tulip trees. If you learn only two trees on your first outing, choose the white oak and the tulip tree. These appear on all the tours, sometimes more than once. When you are sure of these guideposts, you will find the next tour easier to follow.

There is no typical leaf form any more than there is a typical New Yorker. For this reason, a pictured leaf can give only a hint of the variations to be found within a species or even on the same tree. Beginners tend to rely too much on leaf form, sometimes missing easier and more constant keys such as bark or fruit. With practise, the separate characteristics -- leaves, bark, twigs, buds, fruit, and branching habit -- begin to merge into a single impression. You will find yourself recognizing trees, as you do your friends, at a glance.

Tour I is equally divided between native and exotic trees and serves as introduction to the most frequently encountered trees in the Park, as well as to the rarest, the Camperdown elm. On Tour II, natives outnumber exotics two to one. There are two opportunities to compare and review the native oaks, and to admire the oldest tree in Prospect Park, the great American elm on the Nethermead. Tour III contains twice as many exotics as natives. Many of these are moderate growers like magnolias and flowering cherries.These and two outstanding Japanese cut-leaf maples are of particular interest to home gardeners. Tour IV is put last because it leaves the security of paths and numbered lamp posts and ventures into uncharted territory. You are very likely to get lost. If you can puzzle out the route, you will discover some trees not found on any of the other tours.Once again on the path, towards the end of the tour, there is an especially good opportunity to compare three different European lindens in a close grouping, with an American linden or basswood nearby for contrast.

The trees in Prospect Park are of superlative size and beauty. The Park itself is the finest naturalistic landscape park in the country. Its history, design, and architecture are fully described and pictured in the . . .Prospect Park Handbook by Clay Lancaster, first curator of Prospect Park.

",,Introduction,2
TOUR 1,"TOUR I

Entrance at Lincoln Road ...","TOUR I

Entrance at Lincoln Road and Ocean Avenue, reached by BMT Brighton Beach Express. Get off at Prospect Park Station and follow arrows to Lincoln Road.",,TOUR 1,3
White pines (Pinus strobus),"As you face the park, take the path...","As you face the park, take the path on the right side of the highway with the playground on your right. Across the highway to the left is a group of about fifteen <i style=""color: rgb(156, 39, 176);"">white pines</i>, <b><i style=""color: rgb(156, 39, 176);"">Pinus strobus</i></b>. The one nearest the walk has an especially dramatic outline, with an arching top that leans over towards the walk.",Pinus strobus,TOUR 1,4
European horsechestnuts (Aesculus hippocastanum),Immediately ahead on the highway ed...,"Immediately ahead on the highway edge is a row of <i style=""color: rgb(156, 39, 176);"">European horsechestnuts</i>, <b><i style=""color: rgb(156, 39, 176);"">Aesculus hippocastanum</i></b>. These trees are extremely showy when in bloom, as their spires of white flowers stand upright on the ends of the branches like candles on a giant's Christmas tree. The shiny brown nuts are not edible.",Aesculus hippocastanum,TOUR 1,5
White oak (Quercus alba),"On the right side of the path, insi...","On the right side of the path, inside the fence, the largest tree, the one with a ring of cement blocks at its base, is a <i style=""color: rgb(156, 39, 176);"">white oak</i>, <b><i style=""color: rgb(156, 39, 176);"">Quercus alba</i></b>. The Park contains a number of oak species and offers an excellent opportunity of studying the characteristics of different oaks and learning how to identify them. The <i style=""color: rgb(156, 39, 176);"">white oak</i> is recognized by the rounded lobes and sinuses of the leaves -- characteristics of the <i style=""color: rgb(156, 39, 176);"">white oak</i> group as a whole -- and specifically by the pale bark which peels off in flakes that become larger and looser towards the top of the tree.",Quercus alba,TOUR 1,6
Turkey oak (Quercus cerris),On the left side of the playground ...,"On the left side of the playground entrance is a rare oak from southern Europe and western Asia. This is the <i style=""color: rgb(156, 39, 176);"">Turkey oak</i>, <b><i style=""color: rgb(156, 39, 176);"">Quercus cerris</i></b>. Its neatly designed leaves closely resemble those of the English oak, Q. robur. The acorns are of exceptional beauty. The nuts are long, slender, and highly polished, and are set off by an extravagantly bristled cup. This specimen is in urgent need of care. Recommended treatment would include shaping the ragged wounds on the trunk for rapid healing, removing the many dead limbs, and keeping all exposed sapwood sealed with tree paint to guard against fungus infection.",Quercus cerris,TOUR 1,7
English oak (Quercus robur),On the left side of the playground ...,"On the left side of the playground entrance is a rare oak from southern Europe and western Asia. This is the Turkey oak, Quercus cerris. Its neatly designed leaves closely resemble those of the <i style=""color: rgb(156, 39, 176);"">English oak</i>, <b><i style=""color: rgb(156, 39, 176);"">Q. robur</i></b>. The acorns are of exceptional beauty. The nuts are long, slender, and highly polished, and are set off by an extravagantly bristled cup. This specimen is in urgent need of care. Recommended treatment would include shaping the ragged wounds on the trunk for rapid healing, removing the many dead limbs, and keeping all exposed sapwood sealed with tree paint to guard against fungus infection.",Quercus robur,TOUR 1,8
Pin oak (Quercus palustris),"To the left of the Turkey oak, near...","To the left of the Turkey oak, nearer the playground fence, is a native <i style=""color: rgb(156, 39, 176);"">pin oak</i>, <b><i style=""color: rgb(156, 39, 176);"">Quercus palustris</i></b>. Like other members of the red oak group, the <i style=""color: rgb(156, 39, 176);"">pin oak</i>'s leaves are sharply pointed and toothed. Their small size and deep indentations give an airy appearance. Slender twigs and the drooping habit of the lower branches are added clues to identification.",Quercus palustris,TOUR 1,9
Box elder (Acer negundo),"For a brief detour, follow the iron...","For a brief detour, follow the iron fence around the corner beyond the comfort station. At its end is a four-trunked <i style=""color: rgb(156, 39, 176);"">box elder</i>, <b><i style=""color: rgb(156, 39, 176);"">Acer negundo</i></b>. The <i style=""color: rgb(156, 39, 176);"">box elder</i> is neither boxwood, alder, nor elderberry but is a kind of maple having three separate leaflets instead of a single leaf. Though the leaves are not easily recognized as belonging to a maple, the chains of winged key fruits are proof of identity.",Acer negundo,TOUR 1,10
Japanese yews (Taxus cuspidata),Returning to the main path and faci...,"Returning to the main path and facing the dual highway, you have on your right a cluster of low evergreens: two <i style=""color: rgb(156, 39, 176);"">Japanese yews</i>, <b><i style=""color: rgb(156, 39, 176);"">Taxus cuspidata</i></b>, with a taller, flat-topped pine behind them. This is a Japanese umbrella pine or Tanyosho pine, Pinus densiflora umbraculifera. Compare the brightness of this pine's foliage with the somber cast of the white pines at the entrance. The flat top of the Tanyosho is formed by the nearly uniform height of its upright branches. In the white pine, horizontal branches may give a flat-topped effect. The strong-growing yew needs heading back where it is crowding the choicer Tanyosho pine.",Taxus cuspidata,TOUR 1,11
Tanyosho pine (Pinus densiflora umbraculifera),Returning to the main path and faci...,"Returning to the main path and facing the dual highway, you have on your right a cluster of low evergreens: two Japanese yews, Taxus cuspidata, with a taller, flat-topped pine behind them. This is a <i style=""color: rgb(156, 39, 176);"">Japanese umbrella pine</i> or <i style=""color: rgb(156, 39, 176);"">Tanyosho pine</i>, <b><i style=""color: rgb(156, 39, 176);"">Pinus densiflora umbraculifera</i></b>. Compare the brightness of this pine's foliage with the somber cast of the white pines at the entrance. The flat top of the Tanyosho is formed by the nearly uniform height of its upright branches. In the white pine, horizontal branches may give a flat-topped effect. The strong-growing yew needs heading back where it is crowding the choicer <i style=""color: rgb(156, 39, 176);"">Tanyosho pine</i>.",Pinus densiflora umbraculifera,TOUR 1,12
White ash (Fraxinus americana),Cross the highway at the traffic li...,"Cross the highway at the traffic light and head into the Park. On the far side, all by itself on your right is a large <i style=""color: rgb(156, 39, 176);"">white ash</i>, <b><i style=""color: rgb(156, 39, 176);"">Fraxinus americana</i></b>. Ashes are of separate sexes. If you see the winged nutlets on an ash you are sure that it is a pistillate or female tree. This specimen is pistillate. Even when the fruits have disappeared, you can see thousands of stiff strings on which they grew. Sportsmen should view the ash special affection. Its wood is nearly as strong as that hickory but much lighter in weight. It is extensively used for the frames of rowboats, canoes, and tennis racquets, and for oars, paddles, and baseball bats.",Fraxinus americana,TOUR 1,13
Scholar trees (Styphnolobium japonicum),"Farther on, just before the path br...","Farther on, just before the path branches to under Cleft Ridge Span, you will see a group of about ten Japanese pagoda or <i style=""color: rgb(156, 39, 176);"">scholar trees</i>, Sophora japonica, on the bank at your right. These are members of the pea family. The smaller trees are presumably seedlings of the older specimens. When covered with a froth of greenish white flowers in August, a season when little else is in bloom, sophoras are the Park's most conspicuous ornament.",Styphnolobium japonicum,TOUR 1,14
Boxwoods (Buxus sempervirens),Follow the path to the refreshment ...,"Follow the path to the refreshment stand. Behind it on your left are three <i style=""color: rgb(156, 39, 176);"">boxwoods</i>, <b><i style=""color: rgb(156, 39, 176);"">Buxus sempervirens</i></b>, and a weeping mulberry, Morus alba pendula. The pendulous top of the mulberry, a freak or sport, would sprawl on the ground if allowed to grow normally. In order to create a fountain effect, the drooping variety is grafted on understock of normal upright mulberry. Weeping cherries and the Camperdown elm which we will see presently are produced by the same method.",Buxus sempervirens,TOUR 1,15
Weeping mulberry (Morus alba),Follow the path to the refreshment ...,"Follow the path to the refreshment stand. Behind it on your left are three boxwoods, Buxus sempervirens, and a <i style=""color: rgb(156, 39, 176);"">weeping mulberry</i>, <b><i style=""color: rgb(156, 39, 176);"">Morus alba</i></b> pendula. The pendulous top of the mulberry, a freak or sport, would sprawl on the ground if allowed to grow normally. In order to create a fountain effect, the drooping variety is grafted on understock of normal upright mulberry. Weeping cherries and the Camperdown elm which we will see presently are produced by the same method.",Morus alba,TOUR 1,16
English yews (Taxus baccata),As you walk back to Cleft Ridge Spa...,"As you walk back to Cleft Ridge Span, notice the <i style=""color: rgb(156, 39, 176);"">English yews</i>, <b><i style=""color: rgb(156, 39, 176);"">Taxus baccata</i></b>, on the right-hand bank. Their smooth reddish bark is distinctive.",Taxus baccata,TOUR 1,17
Himalayan pine (Pinus wallichiana),Walk through the arch....,"Walk through the arch. As you come out, look up to your left into the long, hanging needles of a <i style=""color: rgb(156, 39, 176);"">Himalayan pine</i>, <b><i style=""color: rgb(156, 39, 176);"">Pinus wallichiana</i></b> (syn. P. griffithii). This is a rare pine, one of the finest, and worth a moment's close study. Its needles are in bundles of five, indicating that it belongs to the white pine group. There can be no confusion with our native white pine, Pinus strobus, which has stiff, short needles that reveal the tiered outline of the horizontal branches. In contrast, the branch structure of the <i style=""color: rgb(156, 39, 176);"">Himalayan pine</i> is obscured by a veil of soft, drooping needles. It is strange that this pine, bred in the clean air of the Himalayas, can thrive in the city's contaminated atmosphere. Our native white pine barely survives in the city. The sickly specimen on the bank at your right is a striking contrast to the flourishing Himalayan.
Because of the steepness of the bank and lack of soil-holding shrubs, earth had washed away and exposed the roots of the Himalayan pine to a degree that threatened its stability. Stakes were driven into the bank in an effort to prevent further erosion. This has been only partially successful. A barrier planting of thorny shrubs is needed at the top of the bank to close off the damaging short cut down the slope. The roots need a dressing of topsoil, a mulch of wood chips, and a prickly cover -- perhaps a pegged-down pyracantha -- to prevent trampling. In addition, the straggly yew which is bruising the pine's lower branches should be drastically cut back or removed. This Himalayan pine, the largest specimen on Long Island, is worth making every effort to preserve.",Pinus wallichiana,TOUR 1,18
Camperdown elm (Ulmus glabra 'camperdownii'),"On your right, the widespread tree ...","On your right, the widespread tree surrounded by a fence is the famous <i style=""color: rgb(156, 39, 176);"">Camperdown elm</i>. This is a treasure of the highest order, quite surely the most distinguished tree in the city and possibly in the state. It is a prostrate form of Scotch elm, Ulmus glabra, which has been grafted on a short trunk of normal Scotch elm. Technically this is a weeping tree but unlike the rather flimsy mulberry previously noted, the elm develops limbs that ascend, twist, and curve back on themselves to make a branch pattern of the utmost force, and intricacy.
This specimen is a vegetative descendent of a Scotch elm seedling that failed to develop a normal trunk but crept along the ground. It originated at Camperdown House, the estate of the Earl of Camperdown, near Dundee, Scotland. All Camperdown elms trace back to this one plant which was introduced to cultivation in 1850. Our tree must have been one of the first to be grafted since it is estimated to be over one hundred years old.
On one of the walking tours conducted by the Friends of Prospect Park, it was discovered that the Camperdown elm was gravely threatened by decay resulting from years of neglect and faulty pruning. The main horizontal limb on the Boat House side was a mere shell, hollow to the base, and further weakened by a great untreated wound. The Friends of Prospect Park, unwilling to let the cherished tree die for lack of care, called in the Bartlett Tree Company for diagnosis and estimates, then launched an appeal for funds. People who care deeply about the Park's trees welcomed the opportunity of taking an active part in preserving them. Through voluntary contributions, the Camperdown Fund in its first year was able to treat its namesake and three other notable trees as well.

All elms are susceptible to Dutch elm disease though in varying degrees. The chief protection for healthy elms is to keep them in thriving condition, clear of dead branches, and sprayed against beetles. Even more important is the practise of strict sanitation, which requires the removal and burning of every infected tree as soon as the disease is diagnosed. This is the only way to destroy the new crop of beetles which would otherwise emerge in early spring to carry the deadly fungus to another elm. A large elm can serve as breeding ground for three million bark beetles. It takes only one to kill a tree.
Infected elms left standing until their beetles emerge in early May are a threat to the life of every elm within a two-mile radius -- the Camperdown elm included. However, if the Camperdown had been abandoned to decay, it was quite certainly doomed. Reinforced, pruned, filled, and fed, it has a sporting chance of giving pleasure to future generations of Park visitors. Those who know and love the tree believe that the investment for professional care is a gamble worth the taking.
On the hill beyond the Camperdown elm, in the direction of the Boat House, is a large sophora of imposing form. Usually a high-branched tree, this one has stout horizontal branches thrusting out near the base.",Ulmus glabra 'Camperdownii',TOUR 1,19
Red maple (Acer rubrum),Walk towards the Boat House to the ...,"Walk towards the Boat House to the end of the grassy triangle, then turn towards the lake around lamp post M 120. Looking across the triangle with your back to the Boat House, you will see a tree with six trunks, a multiple-stemmed <i style=""color: rgb(156, 39, 176);"">red maple</i>, <b><i style=""color: rgb(156, 39, 176);"">Acer rubrum</i></b>. Ordinarily <i style=""color: rgb(156, 39, 176);"">red maple</i>s have only one trunk so this individual is quite uncommon.",Acer rubrum,TOUR 1,20
Hornbeam (Carpinus betulus),"As you walk towards the lake, you w...","As you walk towards the lake, you will find a three-trunked specimen of <i style=""color: rgb(156, 39, 176);"">European <i style=""color: rgb(156, 39, 176);"">hornbeam</i></i>, <b><i style=""color: rgb(156, 39, 176);"">Carpinus betulus</i></b>, on your right. The zebra-striped bark of this <i style=""color: rgb(156, 39, 176);"">hornbeam</i> always excites interest and admiration. In summer the tree is hung with chains of fruits made up of three-lobed bracts in pairs, each with a nutlet in its base.",Carpinus betulus,TOUR 1,21
European hornbeam (Carpinus betulus),This triangular area seems to speci...,"This triangular area seems to specialize in many-trunked trees. At the far end of the triangle, by lamp post M 122, is another <i style=""color: rgb(156, 39, 176);"">European hornbeam</i> with so many trunks that it resembles a tropical banyan. This tree, disfigured and endangered by dead limbs, cavities, and jagged stubs, has been pruned and fertilized by the Bartlett Tree Company through the Camperdown Fund.",Carpinus betulus,TOUR 1,22
European larch (Larix decidua),Cross Lullwater Bridge and pause at...,"Cross Lullwater Bridge and pause at the far end. On your left is a <i style=""color: rgb(156, 39, 176);"">European larch</i>, <b><i style=""color: rgb(156, 39, 176);"">Larix decidua</i></b>. Like the bald cypress, this is one of the very few ""evergreens"" that loses its needles in winter. The tree is most attractive in spring when its budding needles resemble pale green chenille. The developing cones, bright crimson in color, look like tiny rosebuds set along the branches. The larch has a second brief season of beauty in autumn when the whole tree turns amber yellow before the needles are shed.

The larch's poor condition, dead branches, and meager growth plainly reflected the hardships of its situation on a bare slope of hard-packed clay. Contributions to the Camperdown Fund made it possible to prune and feed the larch. Soil texture would be improved by a planting of prickly shrubs such as blackberries to prevent further compaction by foot traffic, and by a mulch of humus-forming material.",Larix decidua,TOUR 1,23
Red maple (Acer rubrum),To the right of the bridge is a mor...,"To the right of the bridge is a more normal <i style=""color: rgb(156, 39, 176);"">red maple</i>, this time with only one extra trunk. As it leans out from the bank, the arch of its branches repeats the curve of the bridge, while the foliage -- especially striking in its autumnal red -- is mirrored in the Lullwater. Because of the prominence of its situation, this tree will be the focal point of the view from the Boat House terrace when the long-promised restoration is actually accomplished. The maple was slated for surgery in 1967 to treat a dead crown and cavities in the trunk. However, the Bartlett expert advised waiting to see whether the tree suffers injury to its roots when the retaining wall is built and the lake dredged. Since work on the maple had to be postponed, the money allotted for its care was applied to the historic American elm on the border of the Nethermead. This elm is described in Tour II.",Acer rubrum,TOUR 1,24
Austrian pine (Pinus nigra),Walk a few feet beyond the bridge t...,"Walk a few feet beyond the bridge to a gap in the trees to your right, where you can get a fine view of an <i style=""color: rgb(156, 39, 176);"">Austrian pine</i>, <b><i style=""color: rgb(156, 39, 176);"">Pinus nigra</i></b>, standing alone on the far shore to the left of the Boat House. The boldly patterned bark, marked with conspicuous grayish plates, and dark furrows, shows up particularly well on this specimen.",Pinus nigra,TOUR 1,25
Camperdown elm (Ulmus glabra 'camperdownii'),Retracing your steps over the bridg...,"Retracing your steps over the bridge and passing the multiple-stemmed hornbeam on your right, pause for another view of the <i style=""color: rgb(156, 39, 176);"">Camperdown elm</i> from a distance.",Ulmus glabra 'Camperdownii',TOUR 1,26
Field maple (Acer campestre),Follow the path on the left of the ...,"Follow the path on the left of the triangle to the Boat House and walk in back of it. Just beyond it on the left is an English hedge or <i style=""color: rgb(156, 39, 176);"">field maple</i>, <b><i style=""color: rgb(156, 39, 176);"">Acer campestre</i></b>, with a bottle-shaped trunk that divides about six feet above ground into a cluster of trunks and then into branches. Unfortunately this specimen has deteriorated beyond hope of salvage. The <i style=""color: rgb(156, 39, 176);"">field maple</i> is a highly individual tree with neat small leaves and a compressed, gnarled trunk. Because of its uncommon interest, a young <i style=""color: rgb(156, 39, 176);"">field maple</i> should be planted in the neighborhood of the Boat House to take the place of the dying one.",Acer campestre,TOUR 1,27
Silver-leafed linden (Tilia tomentosa),Near the field maple and closer to ...,"Near the field maple and closer to the lake is a <i style=""color: rgb(156, 39, 176);"">silver-leafed linden</i>, <b><i style=""color: rgb(156, 39, 176);"">Tilia tomentosa</i></b>, which takes its name from the pale, feltlike undersurface of its leaves.",Tilia tomentosa,TOUR 1,28
Black haw (Viburnum prunifolium),Continue ahead to the point where t...,"Continue ahead to the point where the footpath to the men's comfort station branches from the main walk. In the angle of the paths is a <i style=""color: rgb(156, 39, 176);"">black haw</i>, <b><i style=""color: rgb(156, 39, 176);"">Viburnum prunifolium</i></b>, one of our handsomest native shrubs. It is variable in form and sometimes attains the stature of a small tree as this one does. It can be identified by the pattern of its bark, a mosaic of small scalelike flakes, very like the bark of a dogwood but in reduced scale. The foliage turns a glowing rose-wine color in autumn.

At the next fork, turn right at the drinking fountain and walk towards East Wood Arch. The banks on either side of the approach are protected by a simple fence, inconspicuous and effective. Trees and understory shrubs are flourishing and seeding themselves in the untrampled soil. The grove holds fallen leaves which, as they decay, return vital chemicals to the soil and renew its humus content. Notice especially the large beech on the crest of the rise to the right, near lamp post M 215. Its trunk is surrounded by a thicket of youngsters, either seedlings or sucker growth from the roots. Here the forest is renewing itself, as it can do only in congenial soil and in a spot protected from compaction.

As you walk under East Wood Arch, the view on the far side presents an unhappy contrast. With neither fence nor shrubs to protect the surface, the barren slopes are packed hard by unrestricted traffic, exposed to drying from sun and wind, and severely eroded. The effect of root injury to the magnificent trees in this area is painfully evident.",Viburnum prunifolium,TOUR 1,29
