Name,Description,Excerpt,Tree species,Tour,Sequence
Osage orange (Maclura pomifera),"As you cross the bridge, note the O...","As you cross the bridge, note the <i style=""color: rgb(156, 39, 176);"">Osage orange</i> growing below at the far left corner. Since your viewpoint is level with its upper branches, you should be able to spot the ""oranges"" even in early summer when they are still small.",Maclura pomifera,TOUR 2,62
White oak (Quercus alba),"Just before the tall lamp post, N 2...","Just before the tall lamp post, N 254, is a double-trunked tree with a reinforced crotch. Notice how bark has grown out along the rods in an effort to heal the wound. This is one of the easier oaks to identify. Rounded leaf outlines and pale, flaking bark: did you recognize the marks of the <i style=""color: rgb(156, 39, 176);"">white oak</i>?",Quercus alba,TOUR 2,63
Red maples (Acer rubrum),"On the left, just beyond the storm ...","On the left, just beyond the storm sewer and about 20 feet from the edge of the road, is a red or swamp maple, <b><i style=""color: rgb(156, 39, 176);"">Acer rubrum</i></b>. Its red flowers on leafless branches are one of the first signs of spring. Red key fruits and dazzling red autumn color further carry out its name. Young <i style=""color: rgb(156, 39, 176);"">red maples</i> typically have smooth, pale gray bark but this individual has a number of burls -- abnormal growths -- on the trunk.",Acer rubrum,TOUR 2,64
White oak (Quercus alba),"Again on the left, behind lamp post...","Again on the left, behind lamp post N 252, is a large <i style=""color: rgb(156, 39, 176);"">white oak</i>. To its left and partly hidden behind it is a sweet gum, Liquidambar styraciflua. This is recognized by its star-shaped leaves and spiky, woody fruit balls.",Quercus alba,TOUR 2,65
Sweet gum (Liquidambar styraciflua),"Again on the left, behind lamp post...","Again on the left, behind lamp post N 252, is a large white oak. To its left and partly hidden behind it is a <i style=""color: rgb(156, 39, 176);"">sweet gum</i>, <b><i style=""color: rgb(156, 39, 176);"">Liquidambar styraciflua</i></b>. This is recognized by its star-shaped leaves and spiky, woody fruit balls.",Liquidambar styraciflua,TOUR 2,66
Pink-flowering horsechestnut (Aesculus carnea),Just beyond the gravel path on the ...,"Just beyond the gravel path on the left is a <i style=""color: rgb(156, 39, 176);"">pink-flowering horsechestnut</i>, <b><i style=""color: rgb(156, 39, 176);"">Aesculus carnea</i></b>, a hybrid form grafted on common horsechestnut understock. The line of the graft is clearly marked by differing bark color and texture.",Aesculus carnea,TOUR 2,67
Low-branched red oak (Quercus rubra),"Farther along on the right, a numbe...","Farther along on the right, a number of oak species offers an opportunity to review and compare their characteristics. Opposite the tall lamp post N 231 is a <i style=""color: rgb(156, 39, 176);"">low-branched red oak</i>, <b><i style=""color: rgb(156, 39, 176);"">Quercus rubra</i></b>, with another to your right as you face it. Their relatively smooth bark is marked with interlacing lines of lighter gray, giving the illusion that the crevices have been filled with putty. Compare this pattern with the dark, rough bark of the black oak on the near side of lamp post N 223, and with the light gray, flaking bark of the white oak just beyond the asphalt path to the right.",Quercus rubra,TOUR 2,68
Black oak (Quercus velutina),"Farther along on the right, a numbe...","Farther along on the right, a number of oak species offers an opportunity to review and compare their characteristics. Opposite the tall lamp post N 231 is a low-branched red oak, Quercus rubra, with another to your right as you face it. Their relatively smooth bark is marked with interlacing lines of lighter gray, giving the illusion that the crevices have been filled with putty. Compare this pattern with the dark, rough bark of the <i style=""color: rgb(156, 39, 176);"">black oak</i> on the near side of lamp post N 223, and with the light gray, flaking bark of the white oak just beyond the asphalt path to the right.",Quercus velutina,TOUR 2,69
White oak (Quercus alba),"Farther along on the right, a numbe...","Farther along on the right, a number of oak species offers an opportunity to review and compare their characteristics. Opposite the tall lamp post N 231 is a low-branched red oak, Quercus rubra, with another to your right as you face it. Their relatively smooth bark is marked with interlacing lines of lighter gray, giving the illusion that the crevices have been filled with putty. Compare this pattern with the dark, rough bark of the black oak on the near side of lamp post N 223, and with the light gray, flaking bark of the <i style=""color: rgb(156, 39, 176);"">white oak</i> just beyond the asphalt path to the right.",Quercus alba,TOUR 2,70
European cherry (Prunus avium),"As you face the automotive highway,...","As you face the automotive highway, take the asphalt footpath to your left. On your right is a large cherry tree with an unusually tall, straight trunk. Note how the bark is lined with horizontal bands of small pores or lenticels. This is a cultivated <i style=""color: rgb(156, 39, 176);"">European cherry</i>, <b><i style=""color: rgb(156, 39, 176);"">Prunus avium</i></b>, with large flowers and edible fruit.",Prunus avium,TOUR 2,71
White oak (Quercus alba),Across the path is a magnificent tr...,"Across the path is a magnificent tree with a trunk dividing about ten feet above ground. Round-edged leaves, pale flaking bark -- by now you should know a <i style=""color: rgb(156, 39, 176);"">white oak</i> at first sight.",Quercus alba,TOUR 2,72
Black haw (Viburnum prunifolium),"Some distance ahead, on the left by...","Some distance ahead, on the left by lamp post N 229, is an outstandingly fine specimen of <i style=""color: rgb(156, 39, 176);"">black haw</i>, <b><i style=""color: rgb(156, 39, 176);"">Viburnum prunifolium</i></b>, one of our handsomest native shrubs. The red color of its leaf stems and the large size of its flower clusters are unusually decorative. Superior forms like this should be propagated for distribution to nurseries.",Viburnum prunifolium,TOUR 2,73
Sweet pepperbush (Clethra alnifolia),"Another fine native shrub, Clethra ...","Another fine native shrub, <b><i style=""color: rgb(156, 39, 176);"">Clethra alnifolia</i></b>, the <i style=""color: rgb(156, 39, 176);"">sweet pepperbush</i>, grows about fifteen feet from the path on the right, a short distance before you come to lamp post N 230. The clethra has upright spikes of deliciously sweet-scented white flowers, doubly valued for their appearance in midsummer. lf the clethra is not in bloom, you can recognize it by the brown, persistent seed capsules that tip its branches. A sassafras has seeded into the clethra and will destroy the shrub unless it is removed. Extensive planting of clethras would give walkers on this woodland path a special delight.",Clethra alnifolia,TOUR 2,74
Sweet gum (Liquidambar styraciflua),As you come to the division of the ...,"As you come to the division of the path, directly ahead on the the triangle is a <i style=""color: rgb(156, 39, 176);"">sweet gum</i>. Look for the star-shaped leaves and for the prickly fruit balls on the ground or dangling from the outer branches. The <i style=""color: rgb(156, 39, 176);"">sweet gum</i> is valued for its flamboyant autumn color, sometimes showing yellow, apricot, red, and rose-purple on the same tree.",Liquidambar styraciflua,TOUR 2,75
Black cherries (Prunus capollin),"The two trees to the left, with tru...","The two trees to the left, with trunks about a foot apart at the base, are native <i style=""color: rgb(156, 39, 176);"">black cherries</i>, <b><i style=""color: rgb(156, 39, 176);"">Prunus serotina</i></b>. These carry their flowers in long racemes or spikes. The fruit is invaluable food for wild birds as it ripens over a long period.

The path ends at a place where the road was straightened in August 1967, for the benefit of speeding automobiles. Among other trees, a superb Sophora japonica was sacrificed. This was the finest of its species in the Park, with heavy, sculptural burls that gave it a look of great antiquity.

Stand here for a moment to watch the traffic. It violates the tranquility of Olmsted and Vaux's pastoral landscape, designed as a refuge from the noise, rush, and smells of the city. Deterioration of our parks will continue as long as automobiles are given priority over trees and grass.

If you visit Prospect Park on a day when automobiles are banned and bicycles silently skim the roads, you will enjoy the mood of quiet relaxation for which Prospect Park was designed.

Going through the Zoo to Flatbush Avenue and turning right, you come to the Lefferts Homestead, a farmhouse dating from the Revolutionary war and eminently worth a visit. The Homestead is furnished with antiques of the period, many of them provided by the Fort Greene Chapter of the D.A.R. . . .

Even today complaint is made that the drives are not wide enough and we understand that the Department is constantly pressed to enlarge them. Once already it has yielded to such pressure and widened a considerable stretch of road, destroying many of the finest trees on the ground in order to do so, and readjusting walks and other features to the injury of the rural character of the ground.

",Prunus capollin,TOUR 2,76
TOUR 3,"TOUR III

Stranahan Gate on Grand...","TOUR III

Stranahan Gate on Grand Army Plaza near Flatbush Avenue, reached by IRT 7th Avenue subway. Get off at Brooklyn Museum Station and follow arrows to Brooklyn Public Library.",,TOUR 3,77
Austrian pines (Pinus nigra),Take the path at the left of the hi...,"Take the path at the left of the highway as you face the Park, with the Ingersoll Library on your left and the Stranahan statue on your right. Just inside the gate at the left are a dozen <i style=""color: rgb(156, 39, 176);"">Austrian pines</i>, <b><i style=""color: rgb(156, 39, 176);"">Pinus nigra</i></b>. One of these, at the far end of the group on the Flatbush Avenue side, has produced a dense mass of extremely compressed growth near its top. Sports of this sort are propagated by cuttings or grafts to create miniature shrubs for rock gardens or bonsai. It would be an achievement to introduce a new dwarf variety which originated in Prospect Park.",Pinus nigra,TOUR 3,78
Austrian pines (Pinus nigra),"Another Austrian pine, standing alo...","Another <i style=""color: rgb(156, 39, 176);"">Austrian pine</i>, standing alone on the right side of the path, shows an especially decorative silhouette. Like the others, its stiff 6"" needles are in pairs, grayish green in color, and often slightly twisted. The bark of <i style=""color: rgb(156, 39, 176);"">Austrian pine</i>s is distinctively marked with wide gray plateaus separated by dark canyons. This pine has long been a favorite in our parks because of its ability to flourish under city conditions.",Pinus nigra,TOUR 3,79
Blue spruces (Picea pungens),In the same plot at the right are t...,"In the same plot at the right are three <i style=""color: rgb(156, 39, 176);"">blue spruces</i>, <b><i style=""color: rgb(156, 39, 176);"">Picea pungens</i></b> glauca, and two oriental spruces, P. orientalis. The needles of the oriental Spruce, about 1/3"" long, are the smallest of any of the spruces. The sparse, stunted growth of these trees -- in contrast to the thriving Austrian pines -- clearly demonstrates that spruces in general are not adapted to city life.",Picea pungens,TOUR 3,80
Oriental spruces (Picea orientalis),In the same plot at the right are t...,"In the same plot at the right are three blue spruces, Picea pungens glauca, and two <i style=""color: rgb(156, 39, 176);"">oriental spruces</i>, <b><i style=""color: rgb(156, 39, 176);"">P. orientalis</i></b>. The needles of the <i style=""color: rgb(156, 39, 176);"">oriental Spruce</i>, about 1/3"" long, are the smallest of any of the spruces. The sparse, stunted growth of these trees -- in contrast to the thriving Austrian pines -- clearly demonstrates that spruces in general are not adapted to city life.",Picea orientalis,TOUR 3,81
Saucer magnolias (Magnolia soulangeana),In this area are two saucer magnoli...,"In this area are two <i style=""color: rgb(156, 39, 176);"">saucer magnolias</i> (<b><i style=""color: rgb(156, 39, 176);"">Magnolia soulangeana</i></b>), two flowering dogwoods (Cornus florida), and a cut-leaf Japanese maple (Acer palmatum). The last can be identified in winter by its pale gray bark lined with dark, broken, vertical striping.",Magnolia soulangeana,TOUR 3,82
Flowering dogwoods (Cornus florida),In this area are two saucer magnoli...,"In this area are two saucer magnolias (Magnolia soulangeana), two <i style=""color: rgb(156, 39, 176);"">flowering dogwoods</i> (<b><i style=""color: rgb(156, 39, 176);"">Cornus florida</i></b>), and a cut-leaf Japanese maple (Acer palmatum). The last can be identified in winter by its pale gray bark lined with dark, broken, vertical striping.",Cornus florida,TOUR 3,83
Japanese maple (Acer palmatum),In this area are two saucer magnoli...,"In this area are two saucer magnolias (Magnolia soulangeana), two flowering dogwoods (Cornus florida), and a cut-leaf <i style=""color: rgb(156, 39, 176);"">Japanese maple</i> (<b><i style=""color: rgb(156, 39, 176);"">Acer palmatum</i></b>). The last can be identified in winter by its pale gray bark lined with dark, broken, vertical striping.",Acer palmatum,TOUR 3,84
Purple beeches (Fagus sylvatica),Near the police kiosk is a purple b...,"Near the police kiosk is a <i style=""color: rgb(156, 39, 176);"">purple beech</i>, <b><i style=""color: rgb(156, 39, 176);"">Fagus sylvatica</i></b> purpurea, a variety of <i style=""color: rgb(156, 39, 176);"">European beech</i>. <i style=""color: rgb(156, 39, 176);"">Purple beeches</i> were greatly admired and extensively planted by Victorian landscapers and now, grown to enormous size, are a prominent feature of many parks and old estates.",Fagus sylvatica,TOUR 3,85
Two-trunked silverbell (Halesia carolina),"Ahead and to the left, on a little ...","Ahead and to the left, on a little hillock that juts into the path, is a <i style=""color: rgb(156, 39, 176);"">two-trunked silverbell</i>, <b><i style=""color: rgb(156, 39, 176);"">Halesia Carolina</i></b>, a native of our southern states. The bell-shaped flowers appear in great profusion in spring. This specimen is dying and should be replaced.",Halesia carolina,TOUR 3,86
European beech (Fagus sylvatica),As the path turns toward Endale Arc...,"As the path turns toward Endale Arch, on the bank at the right side is a large <i style=""color: rgb(156, 39, 176);"">European beech</i>, <b><i style=""color: rgb(156, 39, 176);"">Fagus sylvatica</i></b>, which probably dates from the Park's original planting. It is characterized by smooth, light gray bark; a habit of surface rooting; long, pointed, shin, brown leaf buds in winter; and, unfortunately, defacing initials carved in the trunk.",Fagus sylvatica,TOUR 3,87
Silver lindens (Tilia tomentosa),"For a short detour, go uphill past ...","For a short detour, go uphill past the arch and look up the slope at the right to a close cluster of <i style=""color: rgb(156, 39, 176);"">silver lindens</i>, <b><i style=""color: rgb(156, 39, 176);"">Tilia tomentosa</i></b>. This species gets both its common and its scientific name from the feltlike underside of its leaves. The bark of this particular group is unusually smooth. On the opposite hill, a similar cluster with more typically striped bark balances this group.

Turn around at this high point for a good view of the Soldiers and Sailors Monument, then walk back towards Endale Arch. Before you reach the fork in the path, notice the shrubby Styrax japonica on the grassy slope on the right. In early June the styrax is hung with pointed white bells set with a yellow clapper and carrying a delicious fragrance. The styrax has clean, trim foliage and is highly recommended as a decorative tree for small properties. It looks its best when pruned to a single trunk, limbed high enough so that one can walk under its arching branches to view the massed flowers against the sky.

Go through the arch: the Long Meadow stretches before you. This is Prospect Park's most renowned feature, a mile-long sweep of unspoiled countryside, the largest expanse of grassland in any city park the world over. More than any other feature, the Long Meadow gives Prospect Park the pastoral quality which is the essence of Olmsted and Vaux's design.",Tilia tomentosa,TOUR 3,88
Ginkgo (Ginkgo biloba),"Taking the right fork of the path, ...","Taking the right fork of the path, you will see -- and perhaps smell -- a large <i style=""color: rgb(156, 39, 176);"">ginkgo</i>, <b><i style=""color: rgb(156, 39, 176);"">Ginkgo biloba</i></b>, on your right. The <i style=""color: rgb(156, 39, 176);"">ginkgo</i> is a familiar city tree easily recognized by its small fan-shaped leaves. This particular specimen is a female tree which bears quantities of evil-smelling fruit in autumn. Only the flesh is offensive: the nut is prized as a delicacy, especially by the Chinese. Female trees are now rare in cultivation as nurserymen propagate and sell only male trees, which of course bear no fruit.",Ginkgo biloba,TOUR 3,89
Tupelo (Nyssa sylvatica),At the left of the footpath and sli...,"At the left of the footpath and slightly ahead is large specimen of <b><i style=""color: rgb(156, 39, 176);"">Nyssa sylvatica</i></b>, known in various localities as <i style=""color: rgb(156, 39, 176);"">sour gum</i>, pepperidge, and <i style=""color: rgb(156, 39, 176);"">tupelo</i>. The last name may be familiar on breakfast tables as it identifies the delicately fragrant <i style=""color: rgb(156, 39, 176);"">tupelo</i> honey. The <i style=""color: rgb(156, 39, 176);"">sour gum</i> is the earliest of our native trees to show autumn color, sometimes turning scarlet or claret red in late July when it glows among its still-green companions.",Nyssa sylvatica,TOUR 3,90
Purple beech (Fagus sylvatica),"At some distance on the right, on t...","At some distance on the right, on the slope of the hill, is a <i style=""color: rgb(156, 39, 176);"">purple beech</i>; and ahead, again on the right two Schwedler maples. Acer platanoides schwedleri, a variety of Norway maple. Their red foliage has a stained glass radiance in spring, especially when seen with the sun behind it. Later, the leaves turn green but an underlying hint of red persists and darkens their color all summer.",Fagus sylvatica,TOUR 3,91
Norway maple (Acer platanoides),"At some distance on the right, on t...","At some distance on the right, on the slope of the hill, is a purple beech; and ahead, again on the right two <i style=""color: rgb(156, 39, 176);"">Schwedler maples</i>. <b><i style=""color: rgb(156, 39, 176);"">Acer platanoides</i></b> schwedleri, a variety of <i style=""color: rgb(156, 39, 176);"">Norway maple</i>. Their red foliage has a stained glass radiance in spring, especially when seen with the sun behind it. Later, the leaves turn green but an underlying hint of red persists and darkens their color all summer.",Acer platanoides,TOUR 3,92
Tulip tree (Liriodendron tulipifera),Behind the maples but higher on the...,"Behind the maples but higher on the bank, the tallest tree is a <i style=""color: rgb(156, 39, 176);"">tulip tree</i>, <b><i style=""color: rgb(156, 39, 176);"">Liriodendron tulipifera</i></b>. One of our finest natives, the <i style=""color: rgb(156, 39, 176);"">tulip tree</i> can be identified by its blunt leaf tips, pale green and orange flowers, and the conelike fruits that show up against the winter sky.",Liriodendron tulipifera,TOUR 3,93
Swamp white oak (Quercus bicolor),There is much dead wood in the tuli...,"There is much dead wood in the tulip tree and in its close neighbor on the right, which also bears a great gash on the street side of its trunk where a car or snow plow struck it. This tree, with low, arching branches and interestingly spiraled, deeply grooved bark, is a <i style=""color: rgb(156, 39, 176);"">swamp white oak</i>, <b><i style=""color: rgb(156, 39, 176);"">Quercus bicolor</i></b>, of outstanding size. Like all members of the white oak group, the leaves of the <i style=""color: rgb(156, 39, 176);"">swamp white oak</i> have rounded lobes and sinuses. Instead of tapering, the leaves broaden towards the tip. Acorns are home in pairs on a short stalk, an infallible clue to identity. Since this exceptionally fine tree and the tulip tree at its elbow are in need of skilled care, contributors to the Camperdown Fund might consider them as candidates for professional treatment in 1968.",Quercus bicolor,TOUR 3,94
London plane (Platanus hispanica),Near Meadowport Arch on the right i...,"Near Meadowport Arch on the right is a large <i style=""color: rgb(156, 39, 176);"">London plane</i>, Platanus acerifolia, a hybrid between the American and oriental planes. The <i style=""color: rgb(156, 39, 176);"">London plane</i> is greatly valued as a street tree because of its tolerance of city hardships, and accordingly is overplanted to the point of monotony. The <i style=""color: rgb(156, 39, 176);"">London plane</i> usually has two seed balls in a cluster while the American (commonly called sycamore or buttonwood) has only one. Many of the seed balls remain on the tree all winter, while the varicolored, peeling bark is distinctive in all seasons.",Platanus hispanica,TOUR 3,95
Sycamore maple (Acer pseudoplatanus),High to the right at the corner of ...,"High to the right at the corner of Meadowport Arch, a <i style=""color: rgb(156, 39, 176);"">sycamore maple</i>, <b><i style=""color: rgb(156, 39, 176);"">Acer pseudoplatanus</i></b>, has a precarious hold on the bank. It demonstrates how roots are exposed by erosion when an unguarded, bare slope invites short cuts. The remedy is a thick barrier of thorny shrubs (the hardy orange with its 4"" steel-tipped spines is ideal) plus cribbing and mulching with wood chips until the soil is stabilized.",Acer pseudoplatanus,TOUR 3,96
Japanese maple (Acer palmatum),Enter Meadowport Arch and take the ...,"Enter Meadowport Arch and take the right-hand passage. As you come out, look up and slightly to the left to enjoy the lacy foliage of one of the choicest trees in the Park, a two-trunked cut-leaf <i style=""color: rgb(156, 39, 176);"">Japanese maple</i> with unusually refined foliage and graceful form. In early May the clear green leaves are complemented by cloudlike filigree of tiny red flowers. The overhanging ailanthus, a weed tree, should be removed before it shades the maple to death.",Acer palmatum,TOUR 3,97
Japanese maple (Acer palmatum),"Taking the path to the left, you pa...","Taking the path to the left, you pass another <i style=""color: rgb(156, 39, 176);"">Japanese maple</i> on the same hillock, this one seen to better advantage as it is not overshadowed by a taller tree.",Acer palmatum,TOUR 3,98
Smooth-leafed elm (Ulmus carpinifolia),Continue circling to the left until...,"Continue circling to the left until you come to a rise close to the road. On the very edge of the road, by an unnumbered tall lamp post with a No Parking sign, is a Eurasian elm of extraordinary form. About ten feet above ground the trunk divides into four massive limbs, three of them nearly horizontal. The vertical one in turn divides into five large limbs. This is a <i style=""color: rgb(156, 39, 176);"">smooth-leafed elm</i>, <b><i style=""color: rgb(156, 39, 176);"">Ulmus carpinifolia</i></b>, a variable species easily confused with the English elm. Both have low, heavy branches and a habit of suckering from the base and roots. The <i style=""color: rgb(156, 39, 176);"">smooth-leafed elm</i>, however, has leaves with smooth tops and hairless undersides, except for minute tufts in the axils of the veins. The leaf of the English elm is rough on top and hairy beneath.",Ulmus carpinifolia,TOUR 3,99
Sour gum (Nyssa sylvatica),Return towards Meadowport Arch....,"Return towards Meadowport Arch. If you take the path on the near side of the grassy island and sight between the two cut-leaf maples, you will see a <i style=""color: rgb(156, 39, 176);"">sour gum</i> on the far bank, standing next to a Himalayan pine. The <i style=""color: rgb(156, 39, 176);"">sour gum</i> is inconspicuous in summer but when it turns burnished red in fall, it lights up the whole area. Its lacquerlike brilliance is especially effective against the soft, hazy green of the pine.",Nyssa sylvatica,TOUR 3,100
Himalayan pine (Pinus wallichiana),Return towards Meadowport Arch....,"Return towards Meadowport Arch. If you take the path on the near side of the grassy island and sight between the two cut-leaf maples, you will see a sour gum on the far bank, standing next to a <i style=""color: rgb(156, 39, 176);"">Himalayan pine</i>. The sour gum is inconspicuous in summer but when it turns burnished red in fall, it lights up the whole area. Its lacquerlike brilliance is especially effective against the soft, hazy green of the pine.",Pinus wallichiana,TOUR 3,101
